{
  "all_passed": false,
  "any_failed": false,
  "cases": {
    "STRATA-010": {
      "blocked_by": "requires a running strata-bridge node driving the pinned game graph; the RankLock ACK exporter wired to that bridge's context",
      "case_id": "STRATA-010",
      "commands": [],
      "description": "Valid proof: Immediate ACK is reconstructed and broadcast",
      "evidence": {
        "environment_probe": {
          "bitcoind": {
            "present": true,
            "resolved": "/tmp/core311/bitcoin-31.1/bin/bitcoind",
            "sha256": "d55c12b0b02001cc16b1481c4075361dcba193100a8143924abda911174c09ec",
            "version": "Bitcoin Core daemon version v31.1.0 bitcoind",
            "version_exit_code": 0
          },
          "bridge_binary": {
            "present": false,
            "searched": "/private/tmp/ranklock-strata-v0252.YIEMqs/matrix/target/debug/strata-bridge"
          },
          "foundationdb": {
            "cluster_file": "/usr/local/etc/foundationdb/fdb.cluster",
            "fdbcli": null,
            "present": true
          }
        },
        "expectation": "Immediate ACK is reconstructed and broadcast",
        "prerequisites": [
          {
            "name": "a running strata-bridge node driving the pinned game graph",
            "probe": "bin/strata-bridge started against the pinned Core regtest and a reachable FoundationDB cluster"
          },
          {
            "name": "the RankLock ACK exporter wired to that bridge's context",
            "probe": "StrataAckExporter publishing to the path bridge-exec's graph/ranklock.rs reads via load_ack_preimage"
          }
        ],
        "scenario": "Valid proof",
        "wording_source": "03_ACCEPTANCE_MATRIX.md (verbatim)"
      },
      "schema": "ranklock-v0252-case-result-v1",
      "status": "not_executed"
    },
    "STRATA-011": {
      "blocked_by": "requires a running strata-bridge node driving the pinned game graph; the RankLock ACK exporter wired to that bridge's context",
      "case_id": "STRATA-011",
      "commands": [],
      "description": "ACK downstream: Existing slash path remains valid",
      "evidence": {
        "environment_probe": {
          "bitcoind": {
            "present": true,
            "resolved": "/tmp/core311/bitcoin-31.1/bin/bitcoind",
            "sha256": "d55c12b0b02001cc16b1481c4075361dcba193100a8143924abda911174c09ec",
            "version": "Bitcoin Core daemon version v31.1.0 bitcoind",
            "version_exit_code": 0
          },
          "bridge_binary": {
            "present": false,
            "searched": "/private/tmp/ranklock-strata-v0252.YIEMqs/matrix/target/debug/strata-bridge"
          },
          "foundationdb": {
            "cluster_file": "/usr/local/etc/foundationdb/fdb.cluster",
            "fdbcli": null,
            "present": true
          }
        },
        "expectation": "Existing slash path remains valid",
        "prerequisites": [
          {
            "name": "a running strata-bridge node driving the pinned game graph",
            "probe": "bin/strata-bridge started against the pinned Core regtest and a reachable FoundationDB cluster"
          },
          {
            "name": "the RankLock ACK exporter wired to that bridge's context",
            "probe": "StrataAckExporter publishing to the path bridge-exec's graph/ranklock.rs reads via load_ack_preimage"
          }
        ],
        "scenario": "ACK downstream",
        "wording_source": "03_ACCEPTANCE_MATRIX.md (verbatim)"
      },
      "schema": "ranklock-v0252-case-result-v1",
      "status": "not_executed"
    },
    "STRATA-012": {
      "blocked_by": "requires a running strata-bridge node driving the pinned game graph; the RankLock ACK exporter wired to that bridge's context",
      "case_id": "STRATA-012",
      "commands": [],
      "description": "Invalid/no proof: No immediate ACK; timeout NACK after CSV",
      "evidence": {
        "environment_probe": {
          "bitcoind": {
            "present": true,
            "resolved": "/tmp/core311/bitcoin-31.1/bin/bitcoind",
            "sha256": "d55c12b0b02001cc16b1481c4075361dcba193100a8143924abda911174c09ec",
            "version": "Bitcoin Core daemon version v31.1.0 bitcoind",
            "version_exit_code": 0
          },
          "bridge_binary": {
            "present": false,
            "searched": "/private/tmp/ranklock-strata-v0252.YIEMqs/matrix/target/debug/strata-bridge"
          },
          "foundationdb": {
            "cluster_file": "/usr/local/etc/foundationdb/fdb.cluster",
            "fdbcli": null,
            "present": true
          }
        },
        "expectation": "No immediate ACK; timeout NACK after CSV",
        "prerequisites": [
          {
            "name": "a running strata-bridge node driving the pinned game graph",
            "probe": "bin/strata-bridge started against the pinned Core regtest and a reachable FoundationDB cluster"
          },
          {
            "name": "the RankLock ACK exporter wired to that bridge's context",
            "probe": "StrataAckExporter publishing to the path bridge-exec's graph/ranklock.rs reads via load_ack_preimage"
          }
        ],
        "scenario": "Invalid/no proof",
        "wording_source": "03_ACCEPTANCE_MATRIX.md (verbatim)"
      },
      "schema": "ranklock-v0252-case-result-v1",
      "status": "not_executed"
    },
    "STRATA-013": {
      "blocked_by": "requires a running strata-bridge node driving the pinned game graph; the RankLock ACK exporter wired to that bridge's context",
      "case_id": "STRATA-013",
      "commands": [],
      "description": "NACK downstream: Existing contested-payout path remains valid",
      "evidence": {
        "environment_probe": {
          "bitcoind": {
            "present": true,
            "resolved": "/tmp/core311/bitcoin-31.1/bin/bitcoind",
            "sha256": "d55c12b0b02001cc16b1481c4075361dcba193100a8143924abda911174c09ec",
            "version": "Bitcoin Core daemon version v31.1.0 bitcoind",
            "version_exit_code": 0
          },
          "bridge_binary": {
            "present": false,
            "searched": "/private/tmp/ranklock-strata-v0252.YIEMqs/matrix/target/debug/strata-bridge"
          },
          "foundationdb": {
            "cluster_file": "/usr/local/etc/foundationdb/fdb.cluster",
            "fdbcli": null,
            "present": true
          }
        },
        "expectation": "Existing contested-payout path remains valid",
        "prerequisites": [
          {
            "name": "a running strata-bridge node driving the pinned game graph",
            "probe": "bin/strata-bridge started against the pinned Core regtest and a reachable FoundationDB cluster"
          },
          {
            "name": "the RankLock ACK exporter wired to that bridge's context",
            "probe": "StrataAckExporter publishing to the path bridge-exec's graph/ranklock.rs reads via load_ack_preimage"
          }
        ],
        "scenario": "NACK downstream",
        "wording_source": "03_ACCEPTANCE_MATRIX.md (verbatim)"
      },
      "schema": "ranklock-v0252-case-result-v1",
      "status": "not_executed"
    },
    "STRATA-014": {
      "blocked_by": "requires a running strata-bridge node driving the pinned game graph; the RankLock ACK exporter wired to that bridge's context",
      "case_id": "STRATA-014",
      "commands": [],
      "description": "Malformed unlock: Hard rejection; no broadcast",
      "evidence": {
        "environment_probe": {
          "bitcoind": {
            "present": true,
            "resolved": "/tmp/core311/bitcoin-31.1/bin/bitcoind",
            "sha256": "d55c12b0b02001cc16b1481c4075361dcba193100a8143924abda911174c09ec",
            "version": "Bitcoin Core daemon version v31.1.0 bitcoind",
            "version_exit_code": 0
          },
          "bridge_binary": {
            "present": false,
            "searched": "/private/tmp/ranklock-strata-v0252.YIEMqs/matrix/target/debug/strata-bridge"
          },
          "foundationdb": {
            "cluster_file": "/usr/local/etc/foundationdb/fdb.cluster",
            "fdbcli": null,
            "present": true
          }
        },
        "expectation": "Hard rejection; no broadcast",
        "prerequisites": [
          {
            "name": "a running strata-bridge node driving the pinned game graph",
            "probe": "bin/strata-bridge started against the pinned Core regtest and a reachable FoundationDB cluster"
          },
          {
            "name": "the RankLock ACK exporter wired to that bridge's context",
            "probe": "StrataAckExporter publishing to the path bridge-exec's graph/ranklock.rs reads via load_ack_preimage"
          }
        ],
        "scenario": "Malformed unlock",
        "wording_source": "03_ACCEPTANCE_MATRIX.md (verbatim)"
      },
      "schema": "ranklock-v0252-case-result-v1",
      "status": "not_executed"
    },
    "STRATA-015": {
      "blocked_by": "requires a running strata-bridge node driving the pinned game graph; the RankLock ACK exporter wired to that bridge's context",
      "case_id": "STRATA-015",
      "commands": [],
      "description": "Wrong hash/context: Hard rejection",
      "evidence": {
        "environment_probe": {
          "bitcoind": {
            "present": true,
            "resolved": "/tmp/core311/bitcoin-31.1/bin/bitcoind",
            "sha256": "d55c12b0b02001cc16b1481c4075361dcba193100a8143924abda911174c09ec",
            "version": "Bitcoin Core daemon version v31.1.0 bitcoind",
            "version_exit_code": 0
          },
          "bridge_binary": {
            "present": false,
            "searched": "/private/tmp/ranklock-strata-v0252.YIEMqs/matrix/target/debug/strata-bridge"
          },
          "foundationdb": {
            "cluster_file": "/usr/local/etc/foundationdb/fdb.cluster",
            "fdbcli": null,
            "present": true
          }
        },